<?xml version="1.0" encoding="UTF-8"?>
<teams xmlns:xsi="http://www.w3.org/2001/XMLSchema-instance"
       xsi:noNamespaceSchemaLocation="schema09.xsd">
    <team id="9">
        <teamName>Ottawa Senators</teamName>
        <teamLosses>47</teamLosses>
    </team>
    <team id="26">
        <teamName>Los Angeles Kings</teamName>
        <teamLosses>42</teamLosses>
    </team>
    <team id="1">
        <teamName>New Jersey Devils</teamName>
        <teamLosses>41</teamLosses>
    </team>
</teams>